<?xml version="1.0" encoding="UTF-8"?>
<!--Sample XML file generated by XMLSpy v2015 sp1 (http://www.altova.com)-->
<Company xmlns:xsi="http://www.w3.org/2001/XMLSchema-instance" Name="String" xsi:noNamespaceSchemaLocation="company.xsd">
	<Department deptId="ADM">
		<deptName>Admin</deptName>
		<deptAddr>LA</deptAddr>
		<Division divId="div1" managerEmpId="4" housedDeptId="ADM">
			<divName>HR</divName>
			<divPhone>346-232-3242</divPhone>
		</Division>
		<Division divId="div2" managerEmpId="1" housedDeptId="ADM">
			<divName>Recruitment</divName>
			<divPhone>346-232-3243</divPhone>
		</Division>
		<Division divId="div3" managerEmpId="3" housedDeptId="ADM">
			<divName>SysAd</divName>
			<divPhone>346-232-3244</divPhone>
		</Division>
	</Department>
	<Department deptId="FIN">
		<deptName>Finance</deptName>
		<deptAddr>LA</deptAddr>
		<Division divId="div4" managerEmpId="5" housedDeptId="FIN">
			<divName>Payroll</divName>
			<divPhone>346-232-3245</divPhone>
		</Division>
		<Division divId="div5" managerEmpId="5" housedDeptId="FIN">
			<divName>Accounting</divName>
			<divPhone>346-232-3246</divPhone>
		</Division>
	</Department>
	<Department deptId="SER">
		<deptName>Services</deptName>
		<deptAddr>LA</deptAddr>
		<Division divId="div6" managerEmpId="2" housedDeptId="SER">
			<divName>Networking</divName>
			<divPhone>346-232-3247</divPhone>
		</Division>
		<Division divId="div7" managerEmpId="2" housedDeptId="SER">
			<divName>SaaS</divName>
			<divPhone>346-232-3248</divPhone>
		</Division>
		<Division divId="div8" managerEmpId="1" housedDeptId="SER">
			<divName>Security</divName>
			<divPhone>346-232-3249</divPhone>
		</Division>
		<Division divId="div9" managerEmpId="1" housedDeptId="SER">
			<divName>Convergence</divName>
			<divPhone>346-232-3250</divPhone>
		</Division>
	</Department>
	<Department deptId="OPR">
		<deptName>Operations</deptName>
		<deptAddr>LA</deptAddr>
		<Division divId="div10" managerEmpId="1" housedDeptId="OPR">
			<divName>Sales</divName>
			<divPhone>346-232-3251</divPhone>
		</Division>
		<Division divId="div11" managerEmpId="4" housedDeptId="OPR">
			<divName>Marketing</divName>
			<divPhone>346-232-3252</divPhone>
		</Division>
		<Division divId="div12" managerEmpId="4" housedDeptId="OPR">
			<divName>Engineering</divName>
			<divPhone>346-232-3253</divPhone>
		</Division>
	</Department>
	<Department deptId="BUS">
		<deptName>Business</deptName>
		<deptAddr>LA</deptAddr>
		<Division divId="div13" managerEmpId="1" housedDeptId="BUS">
			<divName>Business Development</divName>
			<divPhone>346-232-3254</divPhone>
		</Division>
		<Division divId="div14" managerEmpId="1" housedDeptId="BUS">
			<divName>Business Analysis</divName>
			<divPhone>346-232-3255</divPhone>
		</Division>
	</Department>
	<Employee empId="1">
		<empName>PSmith</empName>
		<empPhone>243-235-3253</empPhone>
		<empOffice>LA</empOffice>
		<WorksFor divId="div2" empId="1">
			<percentTime>5</percentTime>
		</WorksFor>
		<WorksFor divId="div3" empId="1">
			<percentTime>5</percentTime>
		</WorksFor>
		<WorksFor divId="div6" empId="1">
			<percentTime>15</percentTime>
		</WorksFor>
		<WorksFor divId="div8" empId="1">
			<percentTime>5</percentTime>
		</WorksFor>
		<WorksFor divId="div10" empId="1">
			<percentTime>60</percentTime>
		</WorksFor>
		<WorksFor divId="div13" empId="1">
			<percentTime>5</percentTime>
		</WorksFor>
		<WorksFor divId="div9" empId="1">
			<percentTime>3</percentTime>
		</WorksFor>
		<WorksFor divId="div14" empId="1">
			<percentTime>2</percentTime>
		</WorksFor>
	</Employee>
	<Employee empId="2">
		<empName>Wong</empName>
		<empPhone>224-234-9065</empPhone>
		<empOffice>LA</empOffice>
		<WorksFor divId="div2" empId="2">
			<percentTime>10</percentTime>
		</WorksFor>
		<WorksFor divId="div3" empId="2">
			<percentTime>10</percentTime>
		</WorksFor>
		<WorksFor divId="div6" empId="2">
			<percentTime>30</percentTime>
		</WorksFor>
		<WorksFor divId="div7" empId="2">
			<percentTime>10</percentTime>
		</WorksFor>
		<WorksFor divId="div1" empId="2">
			<percentTime>10</percentTime>
		</WorksFor>
		<WorksFor divId="div8" empId="2">
			<percentTime>15</percentTime>
		</WorksFor>
		<WorksFor divId="div4" empId="2">
			<percentTime>15</percentTime>
		</WorksFor>
	</Employee>
	<Employee empId="3">
		<empName>Jack</empName>
		<empPhone>243-235-4566</empPhone>
		<empOffice>LA</empOffice>
		<WorksFor divId="div2" empId="3">
			<percentTime>20</percentTime>
		</WorksFor>
		<WorksFor divId="div3" empId="3">
			<percentTime>20</percentTime>
		</WorksFor>
		<WorksFor divId="div8" empId="3">
			<percentTime>60</percentTime>
		</WorksFor>
	</Employee>
	<Employee empId="4">
		<empName>Anne</empName>
		<empPhone>324-876-3768</empPhone>
		<empOffice>LA</empOffice>
		<WorksFor divId="div1" empId="4">
			<percentTime>60</percentTime>
		</WorksFor>
		<WorksFor divId="div2" empId="4">
			<percentTime>10</percentTime>
		</WorksFor>
		<WorksFor divId="div3" empId="4">
			<percentTime>10</percentTime>
		</WorksFor>
		<WorksFor divId="div13" empId="4">
			<percentTime>5</percentTime>
		</WorksFor>
		<WorksFor divId="div14" empId="4">
			<percentTime>5</percentTime>
		</WorksFor>
	</Employee>
	<Employee empId="5">
		<empName>Ben</empName>
		<empPhone>453-249-3275</empPhone>
		<empOffice>LA</empOffice>
		<WorksFor divId="div2" empId="5">
			<percentTime>10</percentTime>
		</WorksFor>
		<WorksFor divId="div3" empId="5">
			<percentTime>10</percentTime>
		</WorksFor>
		<WorksFor divId="div4" empId="5">
			<percentTime>50</percentTime>
		</WorksFor>
		<WorksFor divId="div5" empId="5">
			<percentTime>30</percentTime>
		</WorksFor>
	</Employee>
	<Employee empId="6">
		<empName>Monica</empName>
		<empPhone>935-487-3859</empPhone>
		<empOffice>LA</empOffice>
		<WorksFor divId="div2" empId="6">
			<percentTime>10</percentTime>
		</WorksFor>
		<WorksFor divId="div3" empId="6">
			<percentTime>10</percentTime>
		</WorksFor>
		<WorksFor divId="div6" empId="6">
			<percentTime>60</percentTime>
		</WorksFor>
		<WorksFor divId="div7" empId="6">
			<percentTime>20</percentTime>
		</WorksFor>
	</Employee>
	<Employee empId="7">
		<empName>Jennifer</empName>
		<empPhone>935-487-3869</empPhone>
		<empOffice>LA</empOffice>
		<WorksFor divId="div7" empId="7">
			<percentTime>90</percentTime>
		</WorksFor>
		<WorksFor divId="div2" empId="7">
			<percentTime>5</percentTime>
		</WorksFor>
		<WorksFor divId="div3" empId="7">
			<percentTime>5</percentTime>
		</WorksFor>
	</Employee>
	<Employee empId="8">
		<empName>Mary</empName>
		<empPhone>932-487-3859</empPhone>
		<empOffice>LA</empOffice>
		<WorksFor divId="div11" empId="8">
			<percentTime>90</percentTime>
		</WorksFor>
		<WorksFor divId="div2" empId="8">
			<percentTime>5</percentTime>
		</WorksFor>
		<WorksFor divId="div3" empId="8">
			<percentTime>5</percentTime>
		</WorksFor>
	</Employee>
</Company>
